ID,Tweet,Affect Dimension,Intensity Class,Intensity,Clean_Tweet_Cased,Clean_Tweet
2017-En-10993,The war is right outside your door  #USAToday,anger,1: low amount of anger can be inferred,1,The war is right outside your door USAToday,the war is right outside your door usatoday
2017-En-11499,Fucking hell. Rush for the damn train also no use. Fucking 4min wait. Still sweating.  #smrtruinslives,anger,3: high amount of anger can be inferred,3,Fucking hell. Rush for the damn train also no use. Fucking 4min wait. Still sweating. smrtruinslives,fucking hell. rush for the damn train also no use. fucking 4min wait. still sweating. smrtruinslives
2017-En-11586,@TobyIrish1 Yes but you were specifically fuming about him not signing enough people,anger,2: moderate amount of anger can be inferred,2,Yes but you were specifically fuming about him not signing enough people,yes but you were specifically fuming about him not signing enough people
2017-En-11680,Stuck in a infuriate scrum about hegemonists. #infuriate #scrum #scrum #Stuck,anger,3: high amount of anger can be inferred,3,Stuck in a infuriate scrum about hegemonists. infuriate scrum scrum Stuck,stuck in a infuriate scrum about hegemonists. infuriate scrum scrum stuck
2017-En-10186,@RonMexico760 The guy who calls people 'cuck' and is anti-BLM is offended by idea that he might not be pro-policing reform? That's amazing.,anger,3: high amount of anger can be inferred,3,The guy who calls people 'cuck' and is anti-BLM is offended by idea that he might not be pro-policing reform? That's amazing.,the guy who calls people 'cuck' and is anti-blm is offended by idea that he might not be pro-policing reform? that's amazing.
2017-En-10765,Went n a bodega 4 incense lookd @ the sis behind the counter &amp; it was like a mirror she said where u from I said here she said no originally,anger,0: no anger can be inferred,0,Went n a bodega 4 incense lookd @ the sis behind the counter &amp; it was like a mirror she said where u from I said here she said no originally,went n a bodega 4 incense lookd @ the sis behind the counter &amp; it was like a mirror she said where u from i said here she said no originally
2017-En-10803,"It takes a man to suffer ignorance and smile. Be yourself, no matter what they say. #sting",anger,0: no anger can be inferred,0,"It takes a man to suffer ignorance and smile. Be yourself, no matter what they say. sting","it takes a man to suffer ignorance and smile. be yourself, no matter what they say. sting"
2017-En-11322,@RVAGameBreak @GAHSBasketball @GAJagsFootball  \nGo Jags!!🐆 I think we have a good shot of beating Deep Run tomorrow! #revenge,anger,1: low amount of anger can be inferred,1,\nGo Jags!!leopard I think we have a good shot of beating Deep Run tomorrow! revenge,\ngo jags!!leopard i think we have a good shot of beating deep run tomorrow! revenge
2017-En-10399,@luxbet Did you even give out any pizzas ? Serious fail #hungry  #hangry,anger,1: low amount of anger can be inferred,1,Did you even give out any pizzas ? Serious fail hungry hangry,did you even give out any pizzas ? serious fail hungry hangry
2017-En-11218,@LoyalLadyMalfoy &lt;• change them himself. He follows behind with a scowl pinching his lips and takes the sheets to his room. 'So who is •&gt;,anger,0: no anger can be inferred,0,&lt;• change them himself. He follows behind with a scowl pinching his lips and takes the sheets to his room. 'So who is •&gt;,&lt;• change them himself. he follows behind with a scowl pinching his lips and takes the sheets to his room. 'so who is •&gt;
2017-En-11051,"if u have time 2 open a snap, u have time 2 respond",anger,0: no anger can be inferred,0,"if u have time 2 open a snap, u have time 2 respond","if u have time 2 open a snap, u have time 2 respond"
2017-En-11417,"@Mick727XD I know your furious, i am too, but just stop fucking moaning. We didn't win until the 7th game last season and where we finished.",anger,3: high amount of anger can be inferred,3,"I know your furious, i am too, but just stop fucking moaning. We didn't win until the 7th game last season and where we finished.","i know your furious, i am too, but just stop fucking moaning. we didn't win until the 7th game last season and where we finished."
2017-En-11518,Hell hath no fury like a sound technician scorned'\n\nThat's the quote right,anger,1: low amount of anger can be inferred,1,Hell hath no fury like a sound technician scorned'\n\nThat's the quote right,hell hath no fury like a sound technician scorned'\n\nthat's the quote right
2017-En-11182,Nothing more entertaining and frightening than a #bitter #alcoholic trying desperately to get your attention.....,anger,2: moderate amount of anger can be inferred,2,Nothing more entertaining and frightening than a bitter alcoholic trying desperately to get your attention.....,nothing more entertaining and frightening than a bitter alcoholic trying desperately to get your attention.....
2017-En-10697,"Are you lost in the fury, fearing that you'll fail?",anger,0: no anger can be inferred,0,"Are you lost in the fury, fearing that you'll fail?","are you lost in the fury, fearing that you'll fail?"
2017-En-10402,I guess #bradangelina &gt; #anger &gt; #blacklivesmatter,anger,2: moderate amount of anger can be inferred,2,I guess bradangelina &gt; anger &gt; blacklivesmatter,i guess bradangelina &gt; anger &gt; blacklivesmatter
2017-En-10756,@MetsProspectHub @brianpmangan taking offense to acount...he ranks 32 of 36 over last 2 years by SABR,anger,0: no anger can be inferred,0,taking offense to acount...he ranks 32 of 36 over last 2 years by SABR,taking offense to acount...he ranks 32 of 36 over last 2 years by sabr
2017-En-10575,Nahhhhhh @konanplaydirty snap story has got me bussing up 😂😂😂😂😂😂😂😂😂😂😂😂😂😂,anger,1: low amount of anger can be inferred,1,Nahhhhhh snap story has got me bussing up face_with_tears_of_joyface_with_tears_of_joyface_with_tears_of_joyface_with_tears_of_joyface_with_tears_of_joyface_with_tears_of_joyface_with_tears_of_joyface_with_tears_of_joyface_with_tears_of_joyface_with_tears_of_joyface_with_tears_of_joyface_with_tears_of_joyface_with_tears_of_joyface_with_tears_of_joy,nahhhhhh snap story has got me bussing up face_with_tears_of_joyface_with_tears_of_joyface_with_tears_of_joyface_with_tears_of_joyface_with_tears_of_joyface_with_tears_of_joyface_with_tears_of_joyface_with_tears_of_joyface_with_tears_of_joyface_with_tears_of_joyface_with_tears_of_joyface_with_tears_of_joyface_with_tears_of_joyface_with_tears_of_joy
2017-En-10493,I just don't understand why everyone is so #angry we all just want to live and thrive don't we?,anger,1: low amount of anger can be inferred,1,I just don't understand why everyone is so angry we all just want to live and thrive don't we?,i just don't understand why everyone is so angry we all just want to live and thrive don't we?
2017-En-11440,I love when people say they aren't racist right before they say some racist shit... Not how that works... ,anger,2: moderate amount of anger can be inferred,2,I love when people say they aren't racist right before they say some racist shit... Not how that works...,i love when people say they aren't racist right before they say some racist shit... not how that works...
2017-En-10999,"@easyJet Hi folks. Flight is going to be over an hour late departing from INV (EZY864), how do we go about getting a refund please? ",anger,3: high amount of anger can be inferred,3,"Hi folks. Flight is going to be over an hour late departing from INV (EZY864), how do we go about getting a refund please?","hi folks. flight is going to be over an hour late departing from inv (ezy864), how do we go about getting a refund please?"
2017-En-11659,"@LindaStein1 Me too,I really hope the writers decide to give us an return to McDanno we all love w/o resentment &amp; animosity fingers crossed",anger,0: no anger can be inferred,0,"Me too,I really hope the writers decide to give us an return to McDanno we all love w/o resentment &amp; animosity fingers crossed","me too,i really hope the writers decide to give us an return to mcdanno we all love w/o resentment &amp; animosity fingers crossed"
2017-En-10293,if we let that in id be fuming poor keeping,anger,2: moderate amount of anger can be inferred,2,if we let that in id be fuming poor keeping,if we let that in id be fuming poor keeping
2017-En-10622,@SarahMi40605180 @kaileighhxo sorry to burst the bubble but there was never any illusion 🙈😂😂,anger,1: low amount of anger can be inferred,1,sorry to burst the bubble but there was never any illusion see-no-evil_monkeyface_with_tears_of_joyface_with_tears_of_joy,sorry to burst the bubble but there was never any illusion see-no-evil_monkeyface_with_tears_of_joyface_with_tears_of_joy
2017-En-10132,@soyoprincess they irritate me. Them and their inch thick made up masks,anger,3: high amount of anger can be inferred,3,they irritate me. Them and their inch thick made up masks,they irritate me. them and their inch thick made up masks
2017-En-10050,Im so angry 😂🙃,anger,3: high amount of anger can be inferred,3,Im so angry face_with_tears_of_joyupside-down_face,im so angry face_with_tears_of_joyupside-down_face
2017-En-10260,@alyssasimpson21 I gave up KENDRICK LAMAR to eat barbecue with him. #bitter,anger,2: moderate amount of anger can be inferred,2,I gave up KENDRICK LAMAR to eat barbecue with him. bitter,i gave up kendrick lamar to eat barbecue with him. bitter
2017-En-11467,Is there a perfume that smells like the smell of smokey incense because i would be all about that,anger,0: no anger can be inferred,0,Is there a perfume that smells like the smell of smokey incense because i would be all about that,is there a perfume that smells like the smell of smokey incense because i would be all about that
2017-En-10233,@luxbet Did you even give out any pizzas ? Serious fail #hungry #furious #hangry,anger,1: low amount of anger can be inferred,1,Did you even give out any pizzas ? Serious fail hungry furious hangry,did you even give out any pizzas ? serious fail hungry furious hangry
2017-En-11293,.@Travelanswerman: B assured there is plenty of salt 2 keep that #fire #burning brightly! Stay #happy N life by keeping plenty #salty… …,anger,0: no anger can be inferred,0,. B assured there is plenty of salt 2 keep that fire burning brightly! Stay happy N life by keeping plenty salty… …,. b assured there is plenty of salt 2 keep that fire burning brightly! stay happy n life by keeping plenty salty… …
2017-En-11526,"Okay you've annoyed me, you haven't done a good job there at all. #furious",anger,3: high amount of anger can be inferred,3,"Okay you've annoyed me, you haven't done a good job there at all. furious","okay you've annoyed me, you haven't done a good job there at all. furious"
2017-En-11679,Stuck in a infuriate scrum about hegemonists.  #scrum #scrum #Stuck,anger,3: high amount of anger can be inferred,3,Stuck in a infuriate scrum about hegemonists. scrum scrum Stuck,stuck in a infuriate scrum about hegemonists. scrum scrum stuck
2017-En-11645,He who is affected by an insult is infected by it.,anger,1: low amount of anger can be inferred,1,He who is affected by an insult is infected by it.,he who is affected by an insult is infected by it.
2017-En-11379,@AdamRichards_10 I done a mix of win and -1 and scores are 2-0 2-0 3-0 4-0 4-0 and then moyes was 1-0 down was fuming. Would of been easy,anger,2: moderate amount of anger can be inferred,2,I done a mix of win and -1 and scores are 2-0 2-0 3-0 4-0 4-0 and then moyes was 1-0 down was fuming. Would of been easy,i done a mix of win and -1 and scores are 2-0 2-0 3-0 4-0 4-0 and then moyes was 1-0 down was fuming. would of been easy
2017-En-11209,i resent being tired and annoyed that the word Wiener is splashed across the news. this should be a slam-dunk for me,anger,2: moderate amount of anger can be inferred,2,i resent being tired and annoyed that the word Wiener is splashed across the news. this should be a slam-dunk for me,i resent being tired and annoyed that the word wiener is splashed across the news. this should be a slam-dunk for me
2017-En-10898,"Realest ever, relentless ever, inevitable that I win.",anger,1: low amount of anger can be inferred,1,"Realest ever, relentless ever, inevitable that I win.","realest ever, relentless ever, inevitable that i win."
2017-En-10894,i live and die for mchanzo honeymoon crashing and burning the second they move in together,anger,2: moderate amount of anger can be inferred,2,i live and die for mchanzo honeymoon crashing and burning the second they move in together,i live and die for mchanzo honeymoon crashing and burning the second they move in together
2017-En-10459,@MetPoliceFC is it true none of your players are cops? Do they drink chilled bitter? Are your players Walter Mitty types? @KeviboyAllen,anger,2: moderate amount of anger can be inferred,2,is it true none of your players are cops? Do they drink chilled bitter? Are your players Walter Mitty types?,is it true none of your players are cops? do they drink chilled bitter? are your players walter mitty types?
2017-En-10330,@eNCA what they should be doing is directing their anger to the thieves in government...#corruption #FeesMustFall,anger,2: moderate amount of anger can be inferred,2,what they should be doing is directing their anger to the thieves in government...corruption FeesMustFall,what they should be doing is directing their anger to the thieves in government...corruption feesmustfall
2017-En-10683,@JoeGoodmanJr. A solution. But the assumptions by media in articles and every other venue causes animosity to the conversation.,anger,0: no anger can be inferred,0,. A solution. But the assumptions by media in articles and every other venue causes animosity to the conversation.,. a solution. but the assumptions by media in articles and every other venue causes animosity to the conversation.
2017-En-10660,"Despite my sharing O'Neill's article, what saddens me about the Gazza case is there seems to be more fury about the sentence than the remark",anger,0: no anger can be inferred,0,"Despite my sharing O'Neill's article, what saddens me about the Gazza case is there seems to be more fury about the sentence than the remark","despite my sharing o'neill's article, what saddens me about the gazza case is there seems to be more fury about the sentence than the remark"
2017-En-10651,"If my luck the rest of Fall goes anything like today, I think I'm going to like this season. #bestdayever #magic #work ",anger,0: no anger can be inferred,0,"If my luck the rest of Fall goes anything like today, I think I'm going to like this season. bestdayever magic work","if my luck the rest of fall goes anything like today, i think i'm going to like this season. bestdayever magic work"
2017-En-11186,@TedLeitner @jesseagler You two are TEN TIMES more interesting than those particular afternoon goofballs (I could say worse). ,anger,0: no anger can be inferred,0,You two are TEN TIMES more interesting than those particular afternoon goofballs (I could say worse).,you two are ten times more interesting than those particular afternoon goofballs (i could say worse).
2017-En-11235,@russbully Ended up paying 75p for half a tube of smarties. Don't even get the pleasure of popping the plastic lid off either ,anger,1: low amount of anger can be inferred,1,Ended up paying 75p for half a tube of smarties. Don't even get the pleasure of popping the plastic lid off either,ended up paying 75p for half a tube of smarties. don't even get the pleasure of popping the plastic lid off either
2017-En-10887,Everybody talking about 'the first day of fall' but summer '16 is never gonna die #revenge @Drake,anger,1: low amount of anger can be inferred,1,Everybody talking about 'the first day of fall' but summer '16 is never gonna die revenge,everybody talking about 'the first day of fall' but summer '16 is never gonna die revenge
2017-En-10830,@Ms_HeartAttack peanut butter takes away the sting,anger,0: no anger can be inferred,0,peanut butter takes away the sting,peanut butter takes away the sting
2017-En-11176,@Remedy0_ switch host no bullet rage.,anger,1: low amount of anger can be inferred,1,switch host no bullet rage.,switch host no bullet rage.
2017-En-11092,no offense but could troye start dming people so i can feel like less of an idiot when i dm him thanks,anger,0: no anger can be inferred,0,no offense but could troye start dming people so i can feel like less of an idiot when i dm him thanks,no offense but could troye start dming people so i can feel like less of an idiot when i dm him thanks
2017-En-10569,"@savageimiike one of my favorite songs brother, real talk. #rage",anger,1: low amount of anger can be inferred,1,"one of my favorite songs brother, real talk. rage","one of my favorite songs brother, real talk. rage"
2017-En-10241,@JasonMillerinDC @realDonaldTrump Prudence suggests that a 8+% bump over 2-3 weeks should be viewed with SKEPTICISM. Media/HRC axis #angry,anger,2: moderate amount of anger can be inferred,2,Prudence suggests that a 8+% bump over 2-3 weeks should be viewed with SKEPTICISM. Media/HRC axis angry,prudence suggests that a 8+% bump over 2-3 weeks should be viewed with skepticism. media/hrc axis angry
2017-En-11536,"@RussellHartness @Mariners @BlueJays :  Wrongdoing!  Grrr.  After the fact, I know, but emailing displeasure now anyway .",anger,2: moderate amount of anger can be inferred,2," Wrongdoing! Grrr. After the fact, I know, but emailing displeasure now anyway ."," wrongdoing! grrr. after the fact, i know, but emailing displeasure now anyway ."
2017-En-40286,@Jacqueline_69 haha! She did well today. I can't get beyond her pout annoying me I'm afraid.,anger,1: low amount of anger can be inferred,1,haha! She did well today. I can't get beyond her pout annoying me I'm afraid.,haha! she did well today. i can't get beyond her pout annoying me i'm afraid.
2017-En-10693,I can't even right now #bb18 ,anger,0: no anger can be inferred,0,I can't even right now bb18,i can't even right now bb18
2017-En-11401,@HotpointUK 'customer service ' beyond appalling. Faulty dryer replacement breaks within wks no parts for 3 wks. Engineers no show. ,anger,3: high amount of anger can be inferred,3,'customer service ' beyond appalling. Faulty dryer replacement breaks within wks no parts for 3 wks. Engineers no show.,'customer service ' beyond appalling. faulty dryer replacement breaks within wks no parts for 3 wks. engineers no show.
2017-En-10589,"@feistyarcher -trouble,' he feigned anger and gave her a look that told her to behave. He knew she wouldn't though, and that was one of -",anger,1: low amount of anger can be inferred,1,"-trouble,' he feigned anger and gave her a look that told her to behave. He knew she wouldn't though, and that was one of -","-trouble,' he feigned anger and gave her a look that told her to behave. he knew she wouldn't though, and that was one of -"
2017-En-10387,"#EpiPen: when public outrage occurs, expand #PAP Patient Assistance Progrm, coupons,rebates .@GOPoversight @OversightDems on #Mylan #Epipen",anger,2: moderate amount of anger can be inferred,2,"EpiPen when public outrage occurs, expand PAP Patient Assistance Progrm, coupons,rebates . on Mylan Epipen","epipen when public outrage occurs, expand pap patient assistance progrm, coupons,rebates . on mylan epipen"
2017-En-10992,The war is right outside your door #rage #USAToday,anger,2: moderate amount of anger can be inferred,2,The war is right outside your door rage USAToday,the war is right outside your door rage usatoday
2017-En-10115,A @FirstBSA not turning up? Why am I not surprised. Late for work again! #fuming,anger,3: high amount of anger can be inferred,3,A not turning up? Why am I not surprised. Late for work again! fuming,a not turning up? why am i not surprised. late for work again! fuming
2017-En-10955,They gonna give this KKk police bitch the minimum sentence..just wattch ,anger,3: high amount of anger can be inferred,3,They gonna give this KKk police bitch the minimum sentence..just wattch,they gonna give this kkk police bitch the minimum sentence..just wattch
2017-En-10634,I have a rage rage ep 2 coming out soon I'll keep you posted on it #YouTube #youtubegaming ,anger,1: low amount of anger can be inferred,1,I have a rage rage ep 2 coming out soon I'll keep you posted on it YouTube youtubegaming,i have a rage rage ep 2 coming out soon i'll keep you posted on it youtube youtubegaming
2017-En-11276,@Bickley_Marotta yea because forcing 5 turnovers and holding a pretty good offense to 7 points is concerning.....oh wait. NO!!,anger,0: no anger can be inferred,0,yea because forcing 5 turnovers and holding a pretty good offense to 7 points is concerning.....oh wait. NO!!,yea because forcing 5 turnovers and holding a pretty good offense to 7 points is concerning.....oh wait. no!!
2017-En-10739,"How can I tell Happy Anniversary, when u are not happy..  #ampalaya #paitpaitanangpeg",anger,0: no anger can be inferred,0,"How can I tell Happy Anniversary, when u are not happy.. ampalaya paitpaitanangpeg","how can i tell happy anniversary, when u are not happy.. ampalaya paitpaitanangpeg"
2017-En-11483,finally leaving my first job soon. i've been working here since i was 16. going to be kind of bitter sweet,anger,0: no anger can be inferred,0,finally leaving my first job soon. i've been working here since i was 16. going to be kind of bitter sweet,finally leaving my first job soon. i've been working here since i was 16. going to be kind of bitter sweet
2017-En-10870,Sorry guys I have absolutely no idea what time i'll be on cam tomorrow but will keep you posted. #fuming,anger,1: low amount of anger can be inferred,1,Sorry guys I have absolutely no idea what time i'll be on cam tomorrow but will keep you posted. fuming,sorry guys i have absolutely no idea what time i'll be on cam tomorrow but will keep you posted. fuming
2017-En-11473,"@SaraLuvvXXX : Whaaaat?!? Oh hell no. I was jealous because you got paid to fuck, but this is a whole new level.  #love #conflicted😬",anger,2: moderate amount of anger can be inferred,2," Whaaaat?!? Oh hell no. I was jealous because you got paid to fuck, but this is a whole new level. love conflictedgrimacing_face"," whaaaat?!? oh hell no. i was jealous because you got paid to fuck, but this is a whole new level. love conflictedgrimacing_face"
2017-En-11018,I just killed a spider so big it sprayed spider guts on me like a horror movie.\n#ugh #revenge,anger,2: moderate amount of anger can be inferred,2,I just killed a spider so big it sprayed spider guts on me like a horror movie.\nugh revenge,i just killed a spider so big it sprayed spider guts on me like a horror movie.\nugh revenge
2017-En-10980,Stop tracking back you fucking potato faced cunt errrr infuriating 😠😠😠😠😠 #angry #Rooney #mufc,anger,3: high amount of anger can be inferred,3,Stop tracking back you fucking potato faced cunt errrr infuriating angry_faceangry_faceangry_faceangry_faceangry_face angry Rooney mufc,stop tracking back you fucking potato faced cunt errrr infuriating angry_faceangry_faceangry_faceangry_faceangry_face angry rooney mufc
2017-En-10551,@hoytschile fury road!!,anger,1: low amount of anger can be inferred,1,fury road!!,fury road!!
2017-En-11151,Every dancers dream song  #worldpower,anger,0: no anger can be inferred,0,Every dancers dream song worldpower,every dancers dream song worldpower
2017-En-10521,@1VoiceMatters @MichaelTPremo just got wind of #MenForChoice and it doesn't infuriate me. Just makes me sad for the generation.,anger,1: low amount of anger can be inferred,1,just got wind of MenForChoice and it doesn't infuriate me. Just makes me sad for the generation.,just got wind of menforchoice and it doesn't infuriate me. just makes me sad for the generation.
2017-En-11240,Constantly fucking boiling and it's not ok,anger,3: high amount of anger can be inferred,3,Constantly fucking boiling and it's not ok,constantly fucking boiling and it's not ok
2017-En-10659,The best revenge is massive success. –Frank Sinatra,anger,0: no anger can be inferred,0,The best revenge is massive success. –Frank Sinatra,the best revenge is massive success. –frank sinatra
2017-En-10439,"So I wished my sis 12 midnight but received no reply from her. My 2nd sis JUST wished her, got a reply. You know who's the fav #offended",anger,2: moderate amount of anger can be inferred,2,"So I wished my sis 12 midnight but received no reply from her. My 2nd sis JUST wished her, got a reply. You know who's the fav offended","so i wished my sis 12 midnight but received no reply from her. my 2nd sis just wished her, got a reply. you know who's the fav offended"
2017-En-10550,@xandraaa5 @amayaallyn6 shut up hashtags are cool ,anger,1: low amount of anger can be inferred,1,shut up hashtags are cool,shut up hashtags are cool
2017-En-11399,Just found out tonight my son will not be doing practical work counting towards his GCSE exam. OK then! I thought STEM was all the rage??,anger,2: moderate amount of anger can be inferred,2,Just found out tonight my son will not be doing practical work counting towards his GCSE exam. OK then! I thought STEM was all the rage??,just found out tonight my son will not be doing practical work counting towards his gcse exam. ok then! i thought stem was all the rage??
2017-En-11636,@JordySloan love that Jordy #revenge ⚽️,anger,0: no anger can be inferred,0,love that Jordy revenge soccer_ball,love that jordy revenge soccer_ball
2017-En-10904,#oow16 #sting decent new song,anger,0: no anger can be inferred,0,oow16 sting decent new song,oow16 sting decent new song
2017-En-11271,@Dominos_UK worst thing is i have confimation from them ,anger,2: moderate amount of anger can be inferred,2,worst thing is i have confimation from them,worst thing is i have confimation from them
