ID,Tweet,Affect Dimension,Intensity Class,Intensity,Clean_Tweet_Cased,Clean_Tweet
2017-En-11662,@MintMilana where is the outrage when black children get killed in the crossfire between blacks shooting each other?,anger,3: high amount of anger can be inferred,3,where is the outrage when black children get killed in the crossfire between blacks shooting each other?,where is the outrage when black children get killed in the crossfire between blacks shooting each other?
2017-En-10938,I hope my hustle don't offend nobody,anger,0: no anger can be inferred,0,I hope my hustle don't offend nobody,i hope my hustle don't offend nobody
2017-En-11609,I swear I got anger issues but my heart big AF...,anger,2: moderate amount of anger can be inferred,2,I swear I got anger issues but my heart big AF...,i swear i got anger issues but my heart big af...
2017-En-10605,My husband found out there are other rabid hockey fans like me as we waited in line 4 of the 6 window stickers were for SJ NHL/AHL hockey.,anger,1: low amount of anger can be inferred,1,My husband found out there are other rabid hockey fans like me as we waited in line 4 of the 6 window stickers were for SJ NHL/AHL hockey.,my husband found out there are other rabid hockey fans like me as we waited in line 4 of the 6 window stickers were for sj nhl/ahl hockey.
2017-En-11027,I HATE little girls 😡😡 got a lot off growing up to do!!! ,anger,3: high amount of anger can be inferred,3,I HATE little girls pouting_facepouting_face got a lot off growing up to do!!!,i hate little girls pouting_facepouting_face got a lot off growing up to do!!!
2017-En-10419,Ok but I just got called a 'White Devil' on the train and I didnt know whether to laugh or be offended,anger,2: moderate amount of anger can be inferred,2,Ok but I just got called a 'White Devil' on the train and I didnt know whether to laugh or be offended,ok but i just got called a 'white devil' on the train and i didnt know whether to laugh or be offended
2017-En-10886,@isthataspider @dhodgs i will fight this guy! Don't insult the lions like that! But seriously they kinda are.Wasted some of the best players,anger,3: high amount of anger can be inferred,3,i will fight this guy! Don't insult the lions like that! But seriously they kinda are.Wasted some of the best players,i will fight this guy! don't insult the lions like that! but seriously they kinda are.wasted some of the best players
2017-En-10392,That grudge you're holding keeps making an appearance because #God wants you to deal with it.,anger,2: moderate amount of anger can be inferred,2,That grudge you're holding keeps making an appearance because God wants you to deal with it.,that grudge you're holding keeps making an appearance because god wants you to deal with it.
2017-En-10469,oh these old things on my face? nah they're not tears from school related anger and frustration nope never,anger,2: moderate amount of anger can be inferred,2,oh these old things on my face? nah they're not tears from school related anger and frustration nope never,oh these old things on my face? nah they're not tears from school related anger and frustration nope never
2017-En-10866,"@huwellwell One chosen by the CLP members! MP seats are not for people to dole out to their mates, we elect candidates. ",anger,1: low amount of anger can be inferred,1,"One chosen by the CLP members! MP seats are not for people to dole out to their mates, we elect candidates.","one chosen by the clp members! mp seats are not for people to dole out to their mates, we elect candidates."
2017-En-11004,@twojacksdetail @bluelivesmtr Very rare an officer just shoots without regard. They don't want that on their conscience. #incite #inflame,anger,3: high amount of anger can be inferred,3,Very rare an officer just shoots without regard. They don't want that on their conscience. incite inflame,very rare an officer just shoots without regard. they don't want that on their conscience. incite inflame
2017-En-10864,My eyes have been dilated. I hate the world right now with the rage of a thousand fiery dragons. I need a drink.,anger,3: high amount of anger can be inferred,3,My eyes have been dilated. I hate the world right now with the rage of a thousand fiery dragons. I need a drink.,my eyes have been dilated. i hate the world right now with the rage of a thousand fiery dragons. i need a drink.
2017-En-11454,@Grace_thomas473 you keep talkin shit and trying to offend me but you're just petty as fuck,anger,3: high amount of anger can be inferred,3,you keep talkin shit and trying to offend me but you're just petty as fuck,you keep talkin shit and trying to offend me but you're just petty as fuck
2017-En-10731,@EAMaddenNFL @EASPORTS I played a game where John Elway was sacked 3x and fumbled all 3x. Is this the same John elway I know of??? ,anger,0: no anger can be inferred,0,I played a game where John Elway was sacked 3x and fumbled all 3x. Is this the same John elway I know of???,i played a game where john elway was sacked 3x and fumbled all 3x. is this the same john elway i know of???
2017-En-10525,@DL_Hart @DonnieDollars @AaronBiggsPro @WWENoWayJose @cwfmidatlantic How did that chop feel? You still feel the sting of it? Looks brutal!,anger,1: low amount of anger can be inferred,1,How did that chop feel? You still feel the sting of it? Looks brutal!,how did that chop feel? you still feel the sting of it? looks brutal!
2017-En-10455,@Kim_is__bored exactly what I have been saying on fb.. #bitter,anger,2: moderate amount of anger can be inferred,2,exactly what I have been saying on fb.. bitter,exactly what i have been saying on fb.. bitter
2017-En-10823,I need to stop second guess myself and just go with the first thought and go with it. ,anger,0: no anger can be inferred,0,I need to stop second guess myself and just go with the first thought and go with it.,i need to stop second guess myself and just go with the first thought and go with it.
2017-En-41074,@loueezecee I don't know how much more of that bloody pout I can take!!,anger,3: high amount of anger can be inferred,3,I don't know how much more of that bloody pout I can take!!,i don't know how much more of that bloody pout i can take!!
2017-En-10243,@TheOneSoleShoe that is one thing but attacking and hating is worse - that makes us just like the angry vengeful behavior we detest,anger,2: moderate amount of anger can be inferred,2,that is one thing but attacking and hating is worse - that makes us just like the angry vengeful behavior we detest,that is one thing but attacking and hating is worse - that makes us just like the angry vengeful behavior we detest
2017-En-11070,@JankHambrams You sound like my husband @Enistachia ... he makes hotter and hotter sauce - the fiery torment brings him mouth-joy! 🔥,anger,0: no anger can be inferred,0,You sound like my husband ... he makes hotter and hotter sauce - the fiery torment brings him mouth-joy! fire,you sound like my husband ... he makes hotter and hotter sauce - the fiery torment brings him mouth-joy! fire
2017-En-10361,I don't get what point is made when reporting on Charlotte looting @CNNAshleigh. Why not explore what looting businesses symbolizes #outrage,anger,2: moderate amount of anger can be inferred,2,I don't get what point is made when reporting on Charlotte looting . Why not explore what looting businesses symbolizes outrage,i don't get what point is made when reporting on charlotte looting . why not explore what looting businesses symbolizes outrage
2017-En-11230,Way towards be prominent if your exasperate is peaked?: TGMbNqUEe,anger,0: no anger can be inferred,0,Way towards be prominent if your exasperate is peaked? TGMbNqUEe,way towards be prominent if your exasperate is peaked? tgmbnquee
2017-En-10116,Police Officers....should NOT have the right to just 'shoot' human beings without provocation. It's wrong.\n\n@ORConservative @MichaelaAngelaD,anger,3: high amount of anger can be inferred,3,Police Officers....should NOT have the right to just 'shoot' human beings without provocation. It's wrong.\n\n,police officers....should not have the right to just 'shoot' human beings without provocation. it's wrong.\n\n
2017-En-11275,@bt_uk broadband is shocking regretting signing up now  #shouldofgonewithvirgin,anger,2: moderate amount of anger can be inferred,2,broadband is shocking regretting signing up now shouldofgonewithvirgin,broadband is shocking regretting signing up now shouldofgonewithvirgin
2017-En-10336,Hell hath not fury like a hamstring cramp. #ouch,anger,2: moderate amount of anger can be inferred,2,Hell hath not fury like a hamstring cramp. ouch,hell hath not fury like a hamstring cramp. ouch
2017-En-11534,@lericoo 35. Do you hold a grudge against your ex?,anger,0: no anger can be inferred,0,35. Do you hold a grudge against your ex?,35. do you hold a grudge against your ex?
2017-En-10269,Did we miss the fact that #BurkeRamsey swung &amp;hit his sister #JonBenet in the face with a golf club previously out of a fit of #anger?,anger,2: moderate amount of anger can be inferred,2,Did we miss the fact that BurkeRamsey swung &amp;hit his sister JonBenet in the face with a golf club previously out of a fit of anger?,did we miss the fact that burkeramsey swung &amp;hit his sister jonbenet in the face with a golf club previously out of a fit of anger?
2017-En-10794,@DMAnthonyJoseph @TheClumpany No grudge. Only truth in abundance.,anger,0: no anger can be inferred,0,No grudge. Only truth in abundance.,no grudge. only truth in abundance.
2017-En-11174,@thehill no wonder USA is going to shit with such outrage over a simple analogy.,anger,2: moderate amount of anger can be inferred,2,no wonder USA is going to shit with such outrage over a simple analogy.,no wonder usa is going to shit with such outrage over a simple analogy.
2017-En-11638,Just love Matthew Parris! Political rage is good!,anger,0: no anger can be inferred,0,Just love Matthew Parris! Political rage is good!,just love matthew parris! political rage is good!
2017-En-40225,@RevTrevK @Wolfman93011 @Daraidernation @EROCKhd Take 2k out of it the numbers on madden are low and have dropped and people are unhappy,anger,2: moderate amount of anger can be inferred,2,Take 2k out of it the numbers on madden are low and have dropped and people are unhappy,take 2k out of it the numbers on madden are low and have dropped and people are unhappy
2017-En-11127,@Gielnorian @HedonismGaming cmode grimrail made me want to eat angry bees,anger,3: high amount of anger can be inferred,3,cmode grimrail made me want to eat angry bees,cmode grimrail made me want to eat angry bees
2017-En-10312,@Idubbbz @LeafyIsHere  I am offended,anger,2: moderate amount of anger can be inferred,2,I am offended,i am offended
2017-En-10166,@SkyUK what a joke!! Cut our internet off early 'by mistake' and then don't reinstate it when we no longer need an engineer 😡 #fuming,anger,3: high amount of anger can be inferred,3,what a joke!! Cut our internet off early 'by mistake' and then don't reinstate it when we no longer need an engineer pouting_face fuming,what a joke!! cut our internet off early 'by mistake' and then don't reinstate it when we no longer need an engineer pouting_face fuming
2017-En-11563,"@natalie_bloomer You interviewed one irate group, two filmmakers who don't live here and got stock statements. That's not journalism.",anger,2: moderate amount of anger can be inferred,2,"You interviewed one irate group, two filmmakers who don't live here and got stock statements. That's not journalism.","you interviewed one irate group, two filmmakers who don't live here and got stock statements. that's not journalism."
2017-En-40228,Some moving clips on youtube tonight of the vigil held at Tulsa Metropolitan Baptist church for #TerenceCruther #justice #anger #sadness,anger,2: moderate amount of anger can be inferred,2,Some moving clips on youtube tonight of the vigil held at Tulsa Metropolitan Baptist church for TerenceCruther justice anger sadness,some moving clips on youtube tonight of the vigil held at tulsa metropolitan baptist church for terencecruther justice anger sadness
2017-En-11385,@xBladeMania 'I didn't see them???' huff.,anger,1: low amount of anger can be inferred,1,'I didn't see them???' huff.,'i didn't see them???' huff.
2017-En-10107,"Leave it on there, rule,nimber 1 of carpet cleaning!!! #furious #worsethananatomicbomb #accidentlyspillbeeronthecarpet",anger,3: high amount of anger can be inferred,3,"Leave it on there, rule,nimber 1 of carpet cleaning!!! furious worsethananatomicbomb accidentlyspillbeeronthecarpet","leave it on there, rule,nimber 1 of carpet cleaning!!! furious worsethananatomicbomb accidentlyspillbeeronthecarpet"
2017-En-10011,Wont use using @mothercareuk @Mothercarehelp again!! These guys cant get nothing right!! #fuming,anger,3: high amount of anger can be inferred,3,Wont use using again!! These guys cant get nothing right!! fuming,wont use using again!! these guys cant get nothing right!! fuming
2017-En-10777,😳The intensity that @sydneyswans play at is extraordinary #relentless #AFLCatsSwans #AFLFinals 🏉👏🏿,anger,0: no anger can be inferred,0,flushed_faceThe intensity that play at is extraordinary relentless AFLCatsSwans AFLFinals rugby_footballclapping_hands_dark_skin_tone,flushed_facethe intensity that play at is extraordinary relentless aflcatsswans aflfinals rugby_footballclapping_hands_dark_skin_tone
2017-En-10902,S/O to the girl that just hit my car...not only did she get lucky w/ no scratch but also from being spared the wrath of sleep deprived Kait🙃,anger,2: moderate amount of anger can be inferred,2,S/O to the girl that just hit my car...not only did she get lucky w/ no scratch but also from being spared the wrath of sleep deprived Kaitupside-down_face,s/o to the girl that just hit my car...not only did she get lucky w/ no scratch but also from being spared the wrath of sleep deprived kaitupside-down_face
2017-En-11666,Will I offend you\nif I am truthful but kind\nor will you see why?\n@baffled #haikuchallenge ,anger,1: low amount of anger can be inferred,1,Will I offend you\nif I am truthful but kind\nor will you see why?\n haikuchallenge,will i offend you\nif i am truthful but kind\nor will you see why?\n haikuchallenge
2017-En-11514,@iAmSJ I'm so mad for our clients I'm furious lmao,anger,3: high amount of anger can be inferred,3,I'm so mad for our clients I'm furious lmao,i'm so mad for our clients i'm furious lmao
2017-En-10975,At work yesterday some old cunt couple told me their coffees were cold and wanted a refund so i put my finger in it front of them angrily,anger,3: high amount of anger can be inferred,3,At work yesterday some old cunt couple told me their coffees were cold and wanted a refund so i put my finger in it front of them angrily,at work yesterday some old cunt couple told me their coffees were cold and wanted a refund so i put my finger in it front of them angrily
2017-En-10275,sorry im so #bitter i just. i either want a pure ur or literally any card from the sets i like but every time i draw for the sets i like&gt;,anger,2: moderate amount of anger can be inferred,2,sorry im so bitter i just. i either want a pure ur or literally any card from the sets i like but every time i draw for the sets i like&gt;,sorry im so bitter i just. i either want a pure ur or literally any card from the sets i like but every time i draw for the sets i like&gt;
2017-En-11397,Another raging storm brought on by my own emotions sorry everyone. enjoy the thunder,anger,3: high amount of anger can be inferred,3,Another raging storm brought on by my own emotions sorry everyone. enjoy the thunder,another raging storm brought on by my own emotions sorry everyone. enjoy the thunder
2017-En-11392,@EE your website is making me feel violent rage and your upgrade options aren't helping either. #Aaaaarrrrgghhh #iwanttocancel #rage,anger,3: high amount of anger can be inferred,3,your website is making me feel violent rage and your upgrade options aren't helping either. Aaaaarrrrgghhh iwanttocancel rage,your website is making me feel violent rage and your upgrade options aren't helping either. aaaaarrrrgghhh iwanttocancel rage
2017-En-11580,@Cass_Pennant @frankbrunoboxer @WestHamUtd @davidgold @MaccaFrank @JonjoHeuerman @WestHamMagazine @CasualMind_ @karren_brady it's an insult.,anger,2: moderate amount of anger can be inferred,2,it's an insult.,it's an insult.
2017-En-10139,@ManUtd you have had from me over the years is irrelevant. Its an absolute joke. #manutd #ticketing  #noloyalty #joke #notimpressed,anger,3: high amount of anger can be inferred,3,you have had from me over the years is irrelevant. Its an absolute joke. manutd ticketing noloyalty joke notimpressed,you have had from me over the years is irrelevant. its an absolute joke. manutd ticketing noloyalty joke notimpressed
2017-En-10801,Happiness is the best revenge,anger,0: no anger can be inferred,0,Happiness is the best revenge,happiness is the best revenge
2017-En-10303,Yo there's a kid on my snap chat from LA &amp; they get high off helium gas lmao.... I am like why the fuck lol,anger,2: moderate amount of anger can be inferred,2,Yo there's a kid on my snap chat from LA &amp; they get high off helium gas lmao.... I am like why the fuck lol,yo there's a kid on my snap chat from la &amp; they get high off helium gas lmao.... i am like why the fuck lol
2017-En-10164,"In 2016, Black people are STILL fighting to be recognized as human beings. #cantsleep ",anger,3: high amount of anger can be inferred,3,"In 2016, Black people are STILL fighting to be recognized as human beings. cantsleep","in 2016, black people are still fighting to be recognized as human beings. cantsleep"
2017-En-10408,@JuliaHB1 Bloody right #fume,anger,2: moderate amount of anger can be inferred,2,Bloody right fume,bloody right fume
2017-En-10923,"Taking umbrage because Jimmy Carr claimed that Bilbo Baggins went to Mordor on 8 out of 10 cats does Countdown. Know your Baggins', mate.",anger,0: no anger can be inferred,0,"Taking umbrage because Jimmy Carr claimed that Bilbo Baggins went to Mordor on 8 out of 10 cats does Countdown. Know your Baggins', mate.","taking umbrage because jimmy carr claimed that bilbo baggins went to mordor on 8 out of 10 cats does countdown. know your baggins', mate."
2017-En-10056,Absolutely fuming that some woman jumped into my prebooked taxi and drove off 😡,anger,3: high amount of anger can be inferred,3,Absolutely fuming that some woman jumped into my prebooked taxi and drove off pouting_face,absolutely fuming that some woman jumped into my prebooked taxi and drove off pouting_face
2017-En-11193,"Do not be angry with God because you do not get what you want, for God gives most when you expect least.",anger,0: no anger can be inferred,0,"Do not be angry with God because you do not get what you want, for God gives most when you expect least.","do not be angry with god because you do not get what you want, for god gives most when you expect least."
2017-En-10869,"Me being on my dean really saving a lot of ppl, bc I don't snap nomore &amp; it take so much out of me..",anger,0: no anger can be inferred,0,"Me being on my dean really saving a lot of ppl, bc I don't snap nomore &amp; it take so much out of me..","me being on my dean really saving a lot of ppl, bc i don't snap nomore &amp; it take so much out of me.."
2017-En-10084,but that was a mistake and a half assed excuse and now here i am burning in hell forever,anger,3: high amount of anger can be inferred,3,but that was a mistake and a half assed excuse and now here i am burning in hell forever,but that was a mistake and a half assed excuse and now here i am burning in hell forever
2017-En-10672,@wcsportscamp I lol'ed.  Privileged exasperation should be bottled and sold.,anger,0: no anger can be inferred,0,I lol'ed. Privileged exasperation should be bottled and sold.,i lol'ed. privileged exasperation should be bottled and sold.
2017-En-10827,Follow me on Snapchat 👻 Carlabtst15 #snapchat ,anger,0: no anger can be inferred,0,Follow me on Snapchat ghost Carlabtst15 snapchat,follow me on snapchat ghost carlabtst15 snapchat
2017-En-10544,#Taurus will react angrily when she can't take being provoked any longer.,anger,1: low amount of anger can be inferred,1,Taurus will react angrily when she can't take being provoked any longer.,taurus will react angrily when she can't take being provoked any longer.
2017-En-10080,@firstleeds not only are your buses unreliable your e ticket app is too unable to get on two buses and late for work #fuming #useless reply,anger,3: high amount of anger can be inferred,3,not only are your buses unreliable your e ticket app is too unable to get on two buses and late for work fuming useless reply,not only are your buses unreliable your e ticket app is too unable to get on two buses and late for work fuming useless reply
2017-En-11542,I'm not use to getting up early asf this shit goin irritate me.,anger,3: high amount of anger can be inferred,3,I'm not use to getting up early asf this shit goin irritate me.,i'm not use to getting up early asf this shit goin irritate me.
2017-En-11267,@cassidyyy_0 literally Nicole already had her chance and she played shitty both seasons. #bitter,anger,2: moderate amount of anger can be inferred,2,literally Nicole already had her chance and she played shitty both seasons. bitter,literally nicole already had her chance and she played shitty both seasons. bitter
2017-En-40208,"@happyandbashful Flirt, simper, pout, repeat. Yuck.",anger,2: moderate amount of anger can be inferred,2,"Flirt, simper, pout, repeat. Yuck.","flirt, simper, pout, repeat. yuck."
2017-En-11562,@emilieragann did another bee sting you on the tongue ?,anger,0: no anger can be inferred,0,did another bee sting you on the tongue ?,did another bee sting you on the tongue ?
2017-En-10449,Hey folks sorry if anything offensive got posted on here yesterday my account got hacked. All fixed now though. I hope :-/ #angry #annoyed,anger,2: moderate amount of anger can be inferred,2,Hey folks sorry if anything offensive got posted on here yesterday my account got hacked. All fixed now though. I hope -/ angry annoyed,hey folks sorry if anything offensive got posted on here yesterday my account got hacked. all fixed now though. i hope -/ angry annoyed
2017-En-10391,I miss doing nothing someone I care about and attacking their face with kisses. #foreveralone #bitter 😩,anger,2: moderate amount of anger can be inferred,2,I miss doing nothing someone I care about and attacking their face with kisses. foreveralone bitter weary_face,i miss doing nothing someone i care about and attacking their face with kisses. foreveralone bitter weary_face
2017-En-10339,@Thebeast_ufc what happened to the suicide tweet it was a joke obviously how could that offend anyone?🤔,anger,2: moderate amount of anger can be inferred,2,what happened to the suicide tweet it was a joke obviously how could that offend anyone?thinking_face,what happened to the suicide tweet it was a joke obviously how could that offend anyone?thinking_face
2017-En-10386,Inner conflict happens when we are at odds with ourselves. Honor your values and priorities.  #innerconflict #conflict #values,anger,2: moderate amount of anger can be inferred,2,Inner conflict happens when we are at odds with ourselves. Honor your values and priorities. innerconflict conflict values,inner conflict happens when we are at odds with ourselves. honor your values and priorities. innerconflict conflict values
2017-En-10839,"Grateful for all the hungry people in my life! Hungry to learn, change, grow, help, etc - not sure anybody has it better! #relentless",anger,0: no anger can be inferred,0,"Grateful for all the hungry people in my life! Hungry to learn, change, grow, help, etc - not sure anybody has it better! relentless","grateful for all the hungry people in my life! hungry to learn, change, grow, help, etc - not sure anybody has it better! relentless"
2017-En-41338,@grumpy_pumper I involuntarily smile when you frown in photos. And giggle. How annoying!!,anger,0: no anger can be inferred,0,I involuntarily smile when you frown in photos. And giggle. How annoying!!,i involuntarily smile when you frown in photos. and giggle. how annoying!!
2017-En-40235,@ImpugnValkyrie *I frown and cup your cheeks in my hands after you step aside.* Angela I care about you. And I don't know how else I can -,anger,0: no anger can be inferred,0,*I frown and cup your cheeks in my hands after you step aside.* Angela I care about you. And I don't know how else I can -,*i frown and cup your cheeks in my hands after you step aside.* angela i care about you. and i don't know how else i can -
2017-En-11512,How on earth can the projection of all that is good and happy and true in my soul be a poisonous fucking snake? #patronus #adder ,anger,3: high amount of anger can be inferred,3,How on earth can the projection of all that is good and happy and true in my soul be a poisonous fucking snake? patronus adder,how on earth can the projection of all that is good and happy and true in my soul be a poisonous fucking snake? patronus adder
2017-En-10797,Houston might lose a coach tomorrow or by midnight.  #yikes #offense?,anger,0: no anger can be inferred,0,Houston might lose a coach tomorrow or by midnight. yikes offense?,houston might lose a coach tomorrow or by midnight. yikes offense?
2017-En-11687,@1BearTruth standard bitter response .... how's it feel to be the small club in a big city,anger,1: low amount of anger can be inferred,1,standard bitter response .... how's it feel to be the small club in a big city,standard bitter response .... how's it feel to be the small club in a big city
