ID,Tweet,Affect Dimension,Intensity Class,Intensity,Clean_Tweet_Cased,Clean_Tweet
2017-En-10652,"also other ppl who i love a whole damn lot; erica, joanna, tiff, sirli, harley, anja, (the rest of the gc bc i ran out of chara!)",anger,0: no anger can be inferred,0,"also other ppl who i love a whole damn lot; erica, joanna, tiff, sirli, harley, anja, (the rest of the gc bc i ran out of chara!)","also other ppl who i love a whole damn lot; erica, joanna, tiff, sirli, harley, anja, (the rest of the gc bc i ran out of chara!)"
2017-En-11284,Marcus Rojo is the worst player i have ever seen. Useless toasting burning bastard,anger,2: moderate amount of anger can be inferred,2,Marcus Rojo is the worst player i have ever seen. Useless toasting burning bastard,marcus rojo is the worst player i have ever seen. useless toasting burning bastard
2017-En-10268,"im on holiday for the next round, fuming!",anger,2: moderate amount of anger can be inferred,2,"im on holiday for the next round, fuming!","im on holiday for the next round, fuming!"
2017-En-11395,The medicine is burning  me,anger,1: low amount of anger can be inferred,1,The medicine is burning me,the medicine is burning me
2017-En-10890,All Brian does is sleep and aggravate me,anger,3: high amount of anger can be inferred,3,All Brian does is sleep and aggravate me,all brian does is sleep and aggravate me
2017-En-10509,@HuffPostUK  NO greater wrath than a woman scorned.,anger,1: low amount of anger can be inferred,1,NO greater wrath than a woman scorned.,no greater wrath than a woman scorned.
2017-En-10178,Can someone make me a priority list of which things I should be outraged at + in which order?  #racism #animalrights #abortion #cops,anger,3: high amount of anger can be inferred,3,Can someone make me a priority list of which things I should be outraged at + in which order? racism animalrights abortion cops,can someone make me a priority list of which things i should be outraged at + in which order? racism animalrights abortion cops
2017-En-10694,Asian Tiger #Mosquitoes are so relentless. More aggressive than the kind I dealt w/as a kid.,anger,0: no anger can be inferred,0,Asian Tiger Mosquitoes are so relentless. More aggressive than the kind I dealt w/as a kid.,asian tiger mosquitoes are so relentless. more aggressive than the kind i dealt w/as a kid.
2017-En-11463,"@gypsydragoness chuckle. 'Any idea girl?' The dragoness let out a frustrated growl, blowing smoke out of her nostrils. The old man nodded +",anger,1: low amount of anger can be inferred,1,"chuckle. 'Any idea girl?' The dragoness let out a frustrated growl, blowing smoke out of her nostrils. The old man nodded +","chuckle. 'any idea girl?' the dragoness let out a frustrated growl, blowing smoke out of her nostrils. the old man nodded +"
2017-En-10646,you know cyran still hasn't done makeup based on jeongguk's tiddy like i suggested and i'm ,anger,0: no anger can be inferred,0,you know cyran still hasn't done makeup based on jeongguk's tiddy like i suggested and i'm,you know cyran still hasn't done makeup based on jeongguk's tiddy like i suggested and i'm
2017-En-10518,Paul forever. Paul should have won! Paul played such a better game! #BB18 #angry,anger,2: moderate amount of anger can be inferred,2,Paul forever. Paul should have won! Paul played such a better game! BB18 angry,paul forever. paul should have won! paul played such a better game! bb18 angry
2017-En-10149,@tmz @HarveyLevinTMZ   Hell hath no fury like a women scorned.    It's the affair.  Not the parenting,anger,3: high amount of anger can be inferred,3,Hell hath no fury like a women scorned. It's the affair. Not the parenting,hell hath no fury like a women scorned. it's the affair. not the parenting
2017-En-11257,Will give #sleepnumber another chance for customer service. Today's growl is 15+ minutes on hold. Overall bed + service = very unimpressive.,anger,2: moderate amount of anger can be inferred,2,Will give sleepnumber another chance for customer service. Today's growl is 15+ minutes on hold. Overall bed + service = very unimpressive.,will give sleepnumber another chance for customer service. today's growl is 15+ minutes on hold. overall bed + service = very unimpressive.
2017-En-10643,"be strong, independant and practical. stop living in your world of fantasy. snap out of it. the faster u get used to the reality, the better",anger,0: no anger can be inferred,0,"be strong, independant and practical. stop living in your world of fantasy. snap out of it. the faster u get used to the reality, the better","be strong, independant and practical. stop living in your world of fantasy. snap out of it. the faster u get used to the reality, the better"
2017-En-11183,What a fucking muppet.  @jRwild1 #fuming #stalker.,anger,3: high amount of anger can be inferred,3,What a fucking muppet. fuming stalker.,what a fucking muppet. fuming stalker.
2017-En-10979,@XboxMAD @RobotBrush Ballmer will be furious. Another delivery lost...,anger,2: moderate amount of anger can be inferred,2,Ballmer will be furious. Another delivery lost...,ballmer will be furious. another delivery lost...
2017-En-10696,@LonelyGoomba I wouldn't bring this up if I were you. It's a very touchy subject. And people get way to offended these days,anger,0: no anger can be inferred,0,I wouldn't bring this up if I were you. It's a very touchy subject. And people get way to offended these days,i wouldn't bring this up if i were you. it's a very touchy subject. and people get way to offended these days
2017-En-10951,@shae_caitlin ur road rage gives me anxiety.,anger,1: low amount of anger can be inferred,1,ur road rage gives me anxiety.,ur road rage gives me anxiety.
2017-En-11036,I wanna kill you and destroy you. I want you died and I want Flint back. #emo #scene  #fuck #die #hatered,anger,3: high amount of anger can be inferred,3,I wanna kill you and destroy you. I want you died and I want Flint back. emo scene fuck die hatered,i wanna kill you and destroy you. i want you died and i want flint back. emo scene fuck die hatered
2017-En-11351,@brian5or6 turn that shit off!   Home Button under Accessibility. \n\nWhen did innovation become mind fuckery?   #rage. #iphonePhoneHome,anger,3: high amount of anger can be inferred,3,turn that shit off! Home Button under Accessibility. \n\nWhen did innovation become mind fuckery? rage. iphonePhoneHome,turn that shit off! home button under accessibility. \n\nwhen did innovation become mind fuckery? rage. iphonephonehome
2017-En-10027,Bloody parking ticket 😒💸 #fuming,anger,3: high amount of anger can be inferred,3,Bloody parking ticket unamused_facemoney_with_wings fuming,bloody parking ticket unamused_facemoney_with_wings fuming
2017-En-10008,"@TeamShanny legit why i am so furious with him, people are such fucking idiots.",anger,3: high amount of anger can be inferred,3,"legit why i am so furious with him, people are such fucking idiots.","legit why i am so furious with him, people are such fucking idiots."
2017-En-11139,@clppng #offended the tonys have found a way to leave me out and now y'all have too,anger,2: moderate amount of anger can be inferred,2,offended the tonys have found a way to leave me out and now y'all have too,offended the tonys have found a way to leave me out and now y'all have too
2017-En-10359,whenever I put 'I wanna be adored' on my brother alwayss sings 'I wanna be a dog' instead just to irritate me,anger,1: low amount of anger can be inferred,1,whenever I put 'I wanna be adored' on my brother alwayss sings 'I wanna be a dog' instead just to irritate me,whenever i put 'i wanna be adored' on my brother alwayss sings 'i wanna be a dog' instead just to irritate me
2017-En-11214,13 hour @bus rides make me #angry #sorry,anger,3: high amount of anger can be inferred,3,13 hour rides make me angry sorry,13 hour rides make me angry sorry
2017-En-10423,Damn our offense is a mix bag of unpredictable lethal weapons I'm worried for Defense Coordinators 😁 #Chargers #Boltup #Recharged,anger,2: moderate amount of anger can be inferred,2,Damn our offense is a mix bag of unpredictable lethal weapons I'm worried for Defense Coordinators beaming_face_with_smiling_eyes Chargers Boltup Recharged,damn our offense is a mix bag of unpredictable lethal weapons i'm worried for defense coordinators beaming_face_with_smiling_eyes chargers boltup recharged
2017-En-11632,@jackmegawphoto what if lives are attached to real estate? Shall I come trash your cameras because I'm angry with what your race is doing?,anger,2: moderate amount of anger can be inferred,2,what if lives are attached to real estate? Shall I come trash your cameras because I'm angry with what your race is doing?,what if lives are attached to real estate? shall i come trash your cameras because i'm angry with what your race is doing?
2017-En-11100,@NJDDanin123 I personally liked #relentless …didn't get #OurHouse #OneJersey #werealldevilsinside \nDoes nothing till a puck drops #NJDevils,anger,0: no anger can be inferred,0,I personally liked relentless …didn't get OurHouse OneJersey werealldevilsinside \nDoes nothing till a puck drops NJDevils,i personally liked relentless …didn't get ourhouse onejersey werealldevilsinside \ndoes nothing till a puck drops njdevils
2017-En-11256,@Cardschatter now that the Bills have a new offense of Cordinator do you think it's more difficult for the @AZCardinals to  game plan?,anger,2: moderate amount of anger can be inferred,2,now that the Bills have a new offense of Cordinator do you think it's more difficult for the to game plan?,now that the bills have a new offense of cordinator do you think it's more difficult for the to game plan?
2017-En-11373,"#TheWordOfGOD #taught, #preached #correctly will #ComfortTheAfflicted &amp; #AfflictTheComfortable; it will #offend &amp; #TellTheTruth #AboutSin!",anger,1: low amount of anger can be inferred,1,"TheWordOfGOD taught, preached correctly will ComfortTheAfflicted &amp; AfflictTheComfortable; it will offend &amp; TellTheTruth AboutSin!","thewordofgod taught, preached correctly will comforttheafflicted &amp; afflictthecomfortable; it will offend &amp; tellthetruth aboutsin!"
2017-En-11301,Dear @TfL please tell your bus drivers if obstruction on their side DON'T just pull out to oncoming traffic causing vehs to swerve #fuming 😡,anger,3: high amount of anger can be inferred,3,Dear please tell your bus drivers if obstruction on their side DON'T just pull out to oncoming traffic causing vehs to swerve fuming pouting_face,dear please tell your bus drivers if obstruction on their side don't just pull out to oncoming traffic causing vehs to swerve fuming pouting_face
2017-En-10764,Don't be bitter,anger,0: no anger can be inferred,0,Don't be bitter,don't be bitter
2017-En-11561,@GroovyBruce @larsrjs44 @AshvsEvilDead the 'groovier' part is an affront to common decency. No way @VancityReynolds agrees.,anger,0: no anger can be inferred,0,the 'groovier' part is an affront to common decency. No way agrees.,the 'groovier' part is an affront to common decency. no way agrees.
2017-En-41184,Dentist just said to me' I'm going to numb your front lip up so it'll feel as if you've got lips like Pete Burns!...... She was right #pout,anger,0: no anger can be inferred,0,Dentist just said to me' I'm going to numb your front lip up so it'll feel as if you've got lips like Pete Burns!...... She was right pout,dentist just said to me' i'm going to numb your front lip up so it'll feel as if you've got lips like pete burns!...... she was right pout
2017-En-10900,"Kik to trade, have fun or a conversation  (kik: youraffair) #kik #kikme #messageme #textme #pics #trade #tradepics #dm #snap #bored",anger,0: no anger can be inferred,0,"Kik to trade, have fun or a conversation (kik youraffair) kik kikme messageme textme pics trade tradepics dm snap bored","kik to trade, have fun or a conversation (kik youraffair) kik kikme messageme textme pics trade tradepics dm snap bored"
2017-En-10438,jamming out to fury in math class wanting to die hbu,anger,2: moderate amount of anger can be inferred,2,jamming out to fury in math class wanting to die hbu,jamming out to fury in math class wanting to die hbu
2017-En-10263,@carefreeash_ id be fuming,anger,2: moderate amount of anger can be inferred,2,id be fuming,id be fuming
2017-En-11623,"I think it's time to change my #irate motif, now that #TalkLikeAPirate Day is over, but...Pirate Minion is so cute, I don't want to. 😟",anger,1: low amount of anger can be inferred,1,"I think it's time to change my irate motif, now that TalkLikeAPirate Day is over, but...Pirate Minion is so cute, I don't want to. worried_face","i think it's time to change my irate motif, now that talklikeapirate day is over, but...pirate minion is so cute, i don't want to. worried_face"
2017-En-11306,Omg someone asked them to sit and they reluctantly moved with a huff. Biiitttccchhhhhh 🔪,anger,3: high amount of anger can be inferred,3,Omg someone asked them to sit and they reluctantly moved with a huff. Biiitttccchhhhhh kitchen_knife,omg someone asked them to sit and they reluctantly moved with a huff. biiitttccchhhhhh kitchen_knife
2017-En-11363,Hell hath no fury like a late twenty something dude who's concur for government session keeps expiring before he can submit a form,anger,2: moderate amount of anger can be inferred,2,Hell hath no fury like a late twenty something dude who's concur for government session keeps expiring before he can submit a form,hell hath no fury like a late twenty something dude who's concur for government session keeps expiring before he can submit a form
2017-En-11035,I wanna kill you and destroy you. I want you died and I want Flint back. #emo #scene #anger #fuck #die #hatered,anger,3: high amount of anger can be inferred,3,I wanna kill you and destroy you. I want you died and I want Flint back. emo scene anger fuck die hatered,i wanna kill you and destroy you. i want you died and i want flint back. emo scene anger fuck die hatered
2017-En-10341,when you find out the initiative isn't even a thing 😧 #revenge,anger,2: moderate amount of anger can be inferred,2,when you find out the initiative isn't even a thing anguished_face revenge,when you find out the initiative isn't even a thing anguished_face revenge
2017-En-10809,Tonight's #DragRace #AllStars2 episode GAVE ME LIFE! Yaassss queens! #teamalaska #teamkatya  #bwahaha,anger,0: no anger can be inferred,0,Tonight's DragRace AllStars2 episode GAVE ME LIFE! Yaassss queens! teamalaska teamkatya bwahaha,tonight's dragrace allstars2 episode gave me life! yaassss queens! teamalaska teamkatya bwahaha
2017-En-10180,You a fuck boy if you run drag routes back to back in madden,anger,3: high amount of anger can be inferred,3,You a fuck boy if you run drag routes back to back in madden,you a fuck boy if you run drag routes back to back in madden
2017-En-11624,"interesting that we,an Authentic Afghan Restaurant,R getting calls from the media over resent tragedy that happened in NJ@latimes @NBCNews",anger,1: low amount of anger can be inferred,1,"interesting that we,an Authentic Afghan Restaurant,R getting calls from the media over resent tragedy that happened in NJ","interesting that we,an authentic afghan restaurant,r getting calls from the media over resent tragedy that happened in nj"
2017-En-11126,So then it's my turn. Soon as he says hi I just burst into tears lmaoo I was so overwhelmed.,anger,0: no anger can be inferred,0,So then it's my turn. Soon as he says hi I just burst into tears lmaoo I was so overwhelmed.,so then it's my turn. soon as he says hi i just burst into tears lmaoo i was so overwhelmed.
2017-En-11188,some of the casuals tweets that Vic has faved are making me gag ,anger,3: high amount of anger can be inferred,3,some of the casuals tweets that Vic has faved are making me gag,some of the casuals tweets that vic has faved are making me gag
2017-En-11180,Manchester derby at home ,anger,0: no anger can be inferred,0,Manchester derby at home,manchester derby at home
2017-En-10723,Keep in mind. We're all weak. Don't insult people just because they're human.,anger,0: no anger can be inferred,0,Keep in mind. We're all weak. Don't insult people just because they're human.,keep in mind. we're all weak. don't insult people just because they're human.
2017-En-11143,Finally uploaded the file I needed to the university server's drop box. It took like half an hour and a lot of cursing and anger on my part,anger,2: moderate amount of anger can be inferred,2,Finally uploaded the file I needed to the university server's drop box. It took like half an hour and a lot of cursing and anger on my part,finally uploaded the file i needed to the university server's drop box. it took like half an hour and a lot of cursing and anger on my part
2017-En-11530,@Arsenal Giroud's beard is making me angry.,anger,3: high amount of anger can be inferred,3,Giroud's beard is making me angry.,giroud's beard is making me angry.
2017-En-11043,@Deadspin @Rlblack1Rob My guess is he's just a convenient target for misplaced anger.  What they're really mad at is how they played.,anger,2: moderate amount of anger can be inferred,2,My guess is he's just a convenient target for misplaced anger. What they're really mad at is how they played.,my guess is he's just a convenient target for misplaced anger. what they're really mad at is how they played.
2017-En-11019,@SopanDeb @johnrobertsFox @azizansari Let's not stereotype all South Asians as relentless beat reporters.,anger,2: moderate amount of anger can be inferred,2,Let's not stereotype all South Asians as relentless beat reporters.,let's not stereotype all south asians as relentless beat reporters.
2017-En-11492,"@Sirenja_ @JaxOfBo (like, hope i didn't offend with my commentary - it wasn't what I was intending!)",anger,2: moderate amount of anger can be inferred,2,"(like, hope i didn't offend with my commentary - it wasn't what I was intending!)","(like, hope i didn't offend with my commentary - it wasn't what i was intending!)"
2017-En-10026,.@DIVAmagazine than straight people. Even the arse straight guys who think that means a threesome is fine. #angry #fuming,anger,3: high amount of anger can be inferred,3,. than straight people. Even the arse straight guys who think that means a threesome is fine. angry fuming,. than straight people. even the arse straight guys who think that means a threesome is fine. angry fuming
2017-En-11059,"People will talk, words will sting, but how you handle that is what differs you from them. Be like them or change the culture?#BeDifferent",anger,0: no anger can be inferred,0,"People will talk, words will sting, but how you handle that is what differs you from them. Be like them or change the culture?BeDifferent","people will talk, words will sting, but how you handle that is what differs you from them. be like them or change the culture?bedifferent"
2017-En-11635,This makes things easier and compact and less fiery or burdened by the weight of sexuality. One releases in the transmutation,anger,0: no anger can be inferred,0,This makes things easier and compact and less fiery or burdened by the weight of sexuality. One releases in the transmutation,this makes things easier and compact and less fiery or burdened by the weight of sexuality. one releases in the transmutation
2017-En-10370,"@CBSBigBrother never bring back Meech and Bridgette. Crying because someone looks at you? Ugh, and Bridgette. #bitter",anger,2: moderate amount of anger can be inferred,2,"never bring back Meech and Bridgette. Crying because someone looks at you? Ugh, and Bridgette. bitter","never bring back meech and bridgette. crying because someone looks at you? ugh, and bridgette. bitter"
2017-En-10930,"@HomeSwapperteam  Spent months arranging swap , new jobs etc, now I've found out she's been leading me on a merry dance. #fuming with her",anger,3: high amount of anger can be inferred,3,"Spent months arranging swap , new jobs etc, now I've found out she's been leading me on a merry dance. fuming with her","spent months arranging swap , new jobs etc, now i've found out she's been leading me on a merry dance. fuming with her"
2017-En-11249,So excited to watch @RuPaulsDragRace #allstars \n#RuPaul #revenge,anger,0: no anger can be inferred,0,So excited to watch allstars \nRuPaul revenge,so excited to watch allstars \nrupaul revenge
2017-En-10005,My blood is boiling,anger,3: high amount of anger can be inferred,3,My blood is boiling,my blood is boiling
2017-En-10322,"@Darren_Hammer amen, nothing personal mate, just tired of all of the complaining from our fans, it's Been a relentless tirade of misery",anger,2: moderate amount of anger can be inferred,2,"amen, nothing personal mate, just tired of all of the complaining from our fans, it's Been a relentless tirade of misery","amen, nothing personal mate, just tired of all of the complaining from our fans, it's been a relentless tirade of misery"
2017-En-11345,@Dak2future decorations are up all over Jersey already ,anger,0: no anger can be inferred,0,decorations are up all over Jersey already,decorations are up all over jersey already
2017-En-10221,I genuinely think I have anger issues,anger,2: moderate amount of anger can be inferred,2,I genuinely think I have anger issues,i genuinely think i have anger issues
2017-En-11622,"@LethalWeaponFOX promised I wouldn't live tweet, but  @DamonkWayans + @ClayneCrawford brought it! @JordanaBrewster and #furious action FTW!",anger,2: moderate amount of anger can be inferred,2,"promised I wouldn't live tweet, but + brought it! and furious action FTW!","promised i wouldn't live tweet, but + brought it! and furious action ftw!"
2017-En-11517,"@Lizombi There's a difference though. A grudge cab be tamed. Feeling uncomfortable is pure emotion, you can't really control it.",anger,2: moderate amount of anger can be inferred,2,"There's a difference though. A grudge cab be tamed. Feeling uncomfortable is pure emotion, you can't really control it.","there's a difference though. a grudge cab be tamed. feeling uncomfortable is pure emotion, you can't really control it."
2017-En-10288,luv seeing a man with a scowl on his face walking with a protein shaker clenching his fists. i immediately stop n suck his dick,anger,2: moderate amount of anger can be inferred,2,luv seeing a man with a scowl on his face walking with a protein shaker clenching his fists. i immediately stop n suck his dick,luv seeing a man with a scowl on his face walking with a protein shaker clenching his fists. i immediately stop n suck his dick
2017-En-11024,"Last night, the Rev. Dr. Earl Johnson spoke to Wake Progressive #Democrats on transforming #moral #outrage into effective political #action.",anger,1: low amount of anger can be inferred,1,"Last night, the Rev. Dr. Earl Johnson spoke to Wake Progressive Democrats on transforming moral outrage into effective political action.","last night, the rev. dr. earl johnson spoke to wake progressive democrats on transforming moral outrage into effective political action."
2017-En-11685,"@robert7019 @itzamadhouse @skyler12388\r\ralso celebrate THEIR belief that Jesus is alive in hell, boiling in a pot of shit (actual shit)",anger,2: moderate amount of anger can be inferred,2,"\r\ralso celebrate THEIR belief that Jesus is alive in hell, boiling in a pot of shit (actual shit)","\r\ralso celebrate their belief that jesus is alive in hell, boiling in a pot of shit (actual shit)"
2017-En-10857,@ZubairSabirPTI  pls dont insult the word 'Molna',anger,2: moderate amount of anger can be inferred,2,pls dont insult the word 'Molna',pls dont insult the word 'molna'
2017-En-11643,Professor: introduce yourselves and say one interesting fact\n\nHi I'm Ethan and the Sun will engulf our planet in a fiery explosion one day,anger,1: low amount of anger can be inferred,1,Professor introduce yourselves and say one interesting fact\n\nHi I'm Ethan and the Sun will engulf our planet in a fiery explosion one day,professor introduce yourselves and say one interesting fact\n\nhi i'm ethan and the sun will engulf our planet in a fiery explosion one day
2017-En-10832,@JaredLeto Jared + #snap? 💘,anger,0: no anger can be inferred,0,Jared + snap? heart_with_arrow,jared + snap? heart_with_arrow
2017-En-11419,@BoJackHorseman if your depressed and somebody calls you long faced will you still automatically take umbrage?,anger,0: no anger can be inferred,0,if your depressed and somebody calls you long faced will you still automatically take umbrage?,if your depressed and somebody calls you long faced will you still automatically take umbrage?
2017-En-40683,"“Do not fret if you are not cool! Humans who follow me, become instantly cool!” #Bot",anger,0: no anger can be inferred,0,"“Do not fret if you are not cool! Humans who follow me, become instantly cool!” Bot","“do not fret if you are not cool! humans who follow me, become instantly cool!” bot"
2017-En-10954,They gonna give this KKk police bitch the minimum sentence..just wattch #angry,anger,3: high amount of anger can be inferred,3,They gonna give this KKk police bitch the minimum sentence..just wattch angry,they gonna give this kkk police bitch the minimum sentence..just wattch angry
2017-En-10018,why are people so offended by kendall he ends photo shoot like seriously shut the fuck up,anger,3: high amount of anger can be inferred,3,why are people so offended by kendall he ends photo shoot like seriously shut the fuck up,why are people so offended by kendall he ends photo shoot like seriously shut the fuck up
2017-En-40444,Candice on great british bake off with that pout does my head in 👊🏻🙄,anger,2: moderate amount of anger can be inferred,2,Candice on great british bake off with that pout does my head in oncoming_fist_light_skin_toneface_with_rolling_eyes,candice on great british bake off with that pout does my head in oncoming_fist_light_skin_toneface_with_rolling_eyes
