ID,Tweet,Affect Dimension,Intensity Class,Intensity,Clean_Tweet_Cased,Clean_Tweet
2017-En-10791,ESPN just assumed I wanted their free magazines ,anger,0: no anger can be inferred,0,ESPN just assumed I wanted their free magazines,espn just assumed i wanted their free magazines
2017-En-10822,snap: hiAleshia 😃,anger,0: no anger can be inferred,0,snap hiAleshia grinning_face_with_big_eyes,snap hialeshia grinning_face_with_big_eyes
2017-En-10296,@LisaAsquithtobe @craig8710 @WayneHaselden @june65wigan everyone is against wigan because we are the biggest club #bitter,anger,2: moderate amount of anger can be inferred,2,everyone is against wigan because we are the biggest club bitter,everyone is against wigan because we are the biggest club bitter
2017-En-10411,@JasonMillerinDC @realDonaldTrump Prudence suggests that a 8+% bump over 2-3 weeks should be viewed with SKEPTICISM. Media/HRC axis ,anger,2: moderate amount of anger can be inferred,2,Prudence suggests that a 8+% bump over 2-3 weeks should be viewed with SKEPTICISM. Media/HRC axis,prudence suggests that a 8+% bump over 2-3 weeks should be viewed with skepticism. media/hrc axis
2017-En-10669,That is at least the 3rd time the balls been burst in our games,anger,0: no anger can be inferred,0,That is at least the 3rd time the balls been burst in our games,that is at least the 3rd time the balls been burst in our games
2017-En-10017,"I hate my lawn mower. If it had a soul, I'd condemn it to the fiery pits of Hell.",anger,3: high amount of anger can be inferred,3,"I hate my lawn mower. If it had a soul, I'd condemn it to the fiery pits of Hell.","i hate my lawn mower. if it had a soul, i'd condemn it to the fiery pits of hell."
2017-En-11508,@brooklynbreeder \nI could not believe that their answer to his outrage was that they were right. I do hope he takes them to the cleaners.,anger,1: low amount of anger can be inferred,1,\nI could not believe that their answer to his outrage was that they were right. I do hope he takes them to the cleaners.,\ni could not believe that their answer to his outrage was that they were right. i do hope he takes them to the cleaners.
2017-En-20479,#BB18 Michelle crying  again #shocking #bitter He's  just not that into you 😢#TeamNicole,anger,2: moderate amount of anger can be inferred,2,BB18 Michelle crying again shocking bitter He's just not that into you crying_faceTeamNicole,bb18 michelle crying again shocking bitter he's just not that into you crying_faceteamnicole
2017-En-10161,"@Slippus @PureGym  yeah I received a fine today which I am furious about, currently appealing it after being a member for so long...",anger,3: high amount of anger can be inferred,3,"yeah I received a fine today which I am furious about, currently appealing it after being a member for so long...","yeah i received a fine today which i am furious about, currently appealing it after being a member for so long..."
2017-En-10196,@CI  I don't think Monalisa has respect for anyone but herself! I think she'll ruffle a few feathers. #TheJail,anger,3: high amount of anger can be inferred,3,I don't think Monalisa has respect for anyone but herself! I think she'll ruffle a few feathers. TheJail,i don't think monalisa has respect for anyone but herself! i think she'll ruffle a few feathers. thejail
2017-En-10763,Don't get #bitter get #BETTER,anger,0: no anger can be inferred,0,Don't get bitter get BETTER,don't get bitter get better
2017-En-11365,There are adults commiting serious crimes in the name of protest.(like burning a library) how are we just expecting them to get a warning?,anger,2: moderate amount of anger can be inferred,2,There are adults commiting serious crimes in the name of protest.(like burning a library) how are we just expecting them to get a warning?,there are adults commiting serious crimes in the name of protest.(like burning a library) how are we just expecting them to get a warning?
2017-En-11613,Janice Griffith snap story  😍😍😍,anger,0: no anger can be inferred,0,Janice Griffith snap story smiling_face_with_heart-eyessmiling_face_with_heart-eyessmiling_face_with_heart-eyes,janice griffith snap story smiling_face_with_heart-eyessmiling_face_with_heart-eyessmiling_face_with_heart-eyes
2017-En-11646,"@RogueFatale Oh, you insult me! What, you think just because I look like this, I'm psycho? I'm more sane than most Gotham freaks...",anger,3: high amount of anger can be inferred,3,"Oh, you insult me! What, you think just because I look like this, I'm psycho? I'm more sane than most Gotham freaks...","oh, you insult me! what, you think just because i look like this, i'm psycho? i'm more sane than most gotham freaks..."
2017-En-20660,"@aroseblush Hello !\nThe bigger the bully, the more crocodile tears. Bullies always act like offended victims.",anger,2: moderate amount of anger can be inferred,2,"Hello !\nThe bigger the bully, the more crocodile tears. Bullies always act like offended victims.","hello !\nthe bigger the bully, the more crocodile tears. bullies always act like offended victims."
2017-En-10478,Now that @Jasmine_Wrn has snapchat back it's a constant battle to see who can get the ugliest snap of one another 😂🙃 #snap survival,anger,1: low amount of anger can be inferred,1,Now that has snapchat back it's a constant battle to see who can get the ugliest snap of one another face_with_tears_of_joyupside-down_face snap survival,now that has snapchat back it's a constant battle to see who can get the ugliest snap of one another face_with_tears_of_joyupside-down_face snap survival
2017-En-10175,Forgot to eat dinner and now I'm furious with everything and everyone,anger,3: high amount of anger can be inferred,3,Forgot to eat dinner and now I'm furious with everything and everyone,forgot to eat dinner and now i'm furious with everything and everyone
2017-En-11394,@delta correction 26 ppl. Checked in. Standing at the gate. &amp; Flt 1449 took off without us. ,anger,1: low amount of anger can be inferred,1,correction 26 ppl. Checked in. Standing at the gate. &amp; Flt 1449 took off without us.,correction 26 ppl. checked in. standing at the gate. &amp; flt 1449 took off without us.
2017-En-10647,The most important thing to #bestrong is to hold your #anger #thoughts,anger,0: no anger can be inferred,0,The most important thing to bestrong is to hold your anger thoughts,the most important thing to bestrong is to hold your anger thoughts
2017-En-11334,"your outrage (your tweets, your jokes, your attention) is *exactly* what M*lo wants\n\n(this is not meant as a defense)",anger,1: low amount of anger can be inferred,1,"your outrage (your tweets, your jokes, your attention) is *exactly* what M*lo wants\n\n(this is not meant as a defense)","your outrage (your tweets, your jokes, your attention) is *exactly* what m*lo wants\n\n(this is not meant as a defense)"
2017-En-11608,@macmel19 come play madden at my house after school,anger,0: no anger can be inferred,0,come play madden at my house after school,come play madden at my house after school
2017-En-11347,@RiveraJose39 happy birthday to my seed‼️‼️‼️ #renewtherivalry #imyourdaddy #cantbeatme  #tater,anger,0: no anger can be inferred,0,happy birthday to my seeddouble_exclamation_markdouble_exclamation_markdouble_exclamation_mark renewtherivalry imyourdaddy cantbeatme tater,happy birthday to my seeddouble_exclamation_markdouble_exclamation_markdouble_exclamation_mark renewtherivalry imyourdaddy cantbeatme tater
2017-En-11190,"Note to self ~ Stop laughing at things that offend you, it's ok to get mad at people \n #NoteToSelf  #mad #upset",anger,1: low amount of anger can be inferred,1,"Note to self ~ Stop laughing at things that offend you, it's ok to get mad at people \n NoteToSelf mad upset","note to self ~ stop laughing at things that offend you, it's ok to get mad at people \n notetoself mad upset"
2017-En-11487,"Anger that you are willing to take out on people &amp; the world in general, &amp; ALL #police, is WORST, most indefensible kind of #anger.",anger,3: high amount of anger can be inferred,3,"Anger that you are willing to take out on people &amp; the world in general, &amp; ALL police, is WORST, most indefensible kind of anger.","anger that you are willing to take out on people &amp; the world in general, &amp; all police, is worst, most indefensible kind of anger."
2017-En-11656,@KClarkSC2 @JohamasSC2 with their faggy colors are nice' is ok too. Even tho some might take offense because WORDS LOL.,anger,0: no anger can be inferred,0,with their faggy colors are nice' is ok too. Even tho some might take offense because WORDS LOL.,with their faggy colors are nice' is ok too. even tho some might take offense because words lol.
2017-En-10183,I can't even right now #bb18 #rage,anger,3: high amount of anger can be inferred,3,I can't even right now bb18 rage,i can't even right now bb18 rage
2017-En-11427,@HillaryClinton It's your party that has divided this nation.  You inflame the minority population as well as pander.  You are a disgrace.,anger,3: high amount of anger can be inferred,3,It's your party that has divided this nation. You inflame the minority population as well as pander. You are a disgrace.,it's your party that has divided this nation. you inflame the minority population as well as pander. you are a disgrace.
2017-En-10278,i have so much hw tonight im offended,anger,2: moderate amount of anger can be inferred,2,i have so much hw tonight im offended,i have so much hw tonight im offended
2017-En-11478,hey long time no tweet but im rooting for paul to win bc he is the only one that played bb and james for 2nd bc he doesnt irritate me #BB18,anger,0: no anger can be inferred,0,hey long time no tweet but im rooting for paul to win bc he is the only one that played bb and james for 2nd bc he doesnt irritate me BB18,hey long time no tweet but im rooting for paul to win bc he is the only one that played bb and james for 2nd bc he doesnt irritate me bb18
2017-En-11354,@hanktastic1776 @sue51684 @EternalRiteWing If you watch his UN speech you can see his resentment towards us Americans!!!!🇺🇸✝🇺🇸,anger,2: moderate amount of anger can be inferred,2,If you watch his UN speech you can see his resentment towards us Americans!!!!United_Stateslatin_crossUnited_States,if you watch his un speech you can see his resentment towards us americans!!!!united_stateslatin_crossunited_states
2017-En-10055,My mind is raging and i just want to end it all,anger,3: high amount of anger can be inferred,3,My mind is raging and i just want to end it all,my mind is raging and i just want to end it all
2017-En-10137,"To'Why can't we brothers protect one another? No one's serious, and it makes me furious. Don't be misled, just think of Fred.' #mayfield",anger,2: moderate amount of anger can be inferred,2,"To'Why can't we brothers protect one another? No one's serious, and it makes me furious. Don't be misled, just think of Fred.' mayfield","to'why can't we brothers protect one another? no one's serious, and it makes me furious. don't be misled, just think of fred.' mayfield"
2017-En-11552,@DP3520 lol they are madden tubers u dont know nothing bout madden cuz id smash on you,anger,2: moderate amount of anger can be inferred,2,lol they are madden tubers u dont know nothing bout madden cuz id smash on you,lol they are madden tubers u dont know nothing bout madden cuz id smash on you
2017-En-11032,I almost feel offended that she thinks that's a big deal. She's knows I'll literally do anything for her or Kai.,anger,2: moderate amount of anger can be inferred,2,I almost feel offended that she thinks that's a big deal. She's knows I'll literally do anything for her or Kai.,i almost feel offended that she thinks that's a big deal. she's knows i'll literally do anything for her or kai.
2017-En-11479,@Toucherandrich there was a US diver named steele johnson. i'd like him barred from the olympics. #offended,anger,2: moderate amount of anger can be inferred,2,there was a US diver named steele johnson. i'd like him barred from the olympics. offended,there was a us diver named steele johnson. i'd like him barred from the olympics. offended
2017-En-11655,"But if you wish to live bitter because your guilty conscience made you think it applied to you as well then that's on you, I'm not sorry💁🏻😊",anger,0: no anger can be inferred,0,"But if you wish to live bitter because your guilty conscience made you think it applied to you as well then that's on you, I'm not sorryperson_tipping_hand_light_skin_tonesmiling_face_with_smiling_eyes","but if you wish to live bitter because your guilty conscience made you think it applied to you as well then that's on you, i'm not sorryperson_tipping_hand_light_skin_tonesmiling_face_with_smiling_eyes"
2017-En-10641,you are an angry glass of vodka,anger,0: no anger can be inferred,0,you are an angry glass of vodka,you are an angry glass of vodka
2017-En-10192,Not giving a fuck is better than revenge.,anger,3: high amount of anger can be inferred,3,Not giving a fuck is better than revenge.,not giving a fuck is better than revenge.
2017-En-10621,People often grudge others what they cannot enjoy themselves.,anger,1: low amount of anger can be inferred,1,People often grudge others what they cannot enjoy themselves.,people often grudge others what they cannot enjoy themselves.
2017-En-40872,"@MHChat sadness with resentment is the past, sadness with fear is the future. try to live in the now #MHchat",anger,0: no anger can be inferred,0,"sadness with resentment is the past, sadness with fear is the future. try to live in the now MHchat","sadness with resentment is the past, sadness with fear is the future. try to live in the now mhchat"
2017-En-10968,Point scorning and fury at Labor does nothing to address long term detention and the need to resettle #asylumseekers from #manus and #Nauru,anger,1: low amount of anger can be inferred,1,Point scorning and fury at Labor does nothing to address long term detention and the need to resettle asylumseekers from manus and Nauru,point scorning and fury at labor does nothing to address long term detention and the need to resettle asylumseekers from manus and nauru
2017-En-10413,@kerrybowen_ you have anger issues!,anger,2: moderate amount of anger can be inferred,2,you have anger issues!,you have anger issues!
2017-En-10760,"Tiangong 1, China's first space laboratory, will come to a fiery end in late 2017. The average decommissioned satellite either burns ...",anger,0: no anger can be inferred,0,"Tiangong 1, China's first space laboratory, will come to a fiery end in late 2017. The average decommissioned satellite either burns ...","tiangong 1, china's first space laboratory, will come to a fiery end in late 2017. the average decommissioned satellite either burns ..."
2017-En-10249,"You will never find someone who loved you like I did. And that my love, will be my revenge.",anger,2: moderate amount of anger can be inferred,2,"You will never find someone who loved you like I did. And that my love, will be my revenge.","you will never find someone who loved you like i did. and that my love, will be my revenge."
2017-En-10897,Might just leave and aggravate bae,anger,1: low amount of anger can be inferred,1,Might just leave and aggravate bae,might just leave and aggravate bae
2017-En-10319,"I really really resent having to go to bed at a sensible hour, you guys. I WANT TO TALK TO MY PEOPLE.",anger,2: moderate amount of anger can be inferred,2,"I really really resent having to go to bed at a sensible hour, you guys. I WANT TO TALK TO MY PEOPLE.","i really really resent having to go to bed at a sensible hour, you guys. i want to talk to my people."
2017-En-10614,What terrible thing to see and have no vision-\n\nHelen Keller-\n\n-Begin with the end in mind-\n\nStephen Covey-\n\n #whereareugoing ,anger,1: low amount of anger can be inferred,1,What terrible thing to see and have no vision-\n\nHelen Keller-\n\n-Begin with the end in mind-\n\nStephen Covey-\n\n whereareugoing,what terrible thing to see and have no vision-\n\nhelen keller-\n\n-begin with the end in mind-\n\nstephen covey-\n\n whereareugoing
2017-En-10326,"I am #real #sjw, I will not let #america down\nI have found us, now go and get us\nI let it out and I let it in\nI #rage I #lol\n@SergioSarzedo",anger,2: moderate amount of anger can be inferred,2,"I am real sjw, I will not let america down\nI have found us, now go and get us\nI let it out and I let it in\nI rage I lol\n","i am real sjw, i will not let america down\ni have found us, now go and get us\ni let it out and i let it in\ni rage i lol\n"
2017-En-11568,"Probably gonna end up seriously poorly at some point soon, so tired, and go from freezing to boiling in the space of seconds",anger,3: high amount of anger can be inferred,3,"Probably gonna end up seriously poorly at some point soon, so tired, and go from freezing to boiling in the space of seconds","probably gonna end up seriously poorly at some point soon, so tired, and go from freezing to boiling in the space of seconds"
2017-En-10878,Literally fuming fuck sake,anger,3: high amount of anger can be inferred,3,Literally fuming fuck sake,literally fuming fuck sake
2017-En-10668,Nor hell a fury like a woman scorned -- William Congreve,anger,0: no anger can be inferred,0,Nor hell a fury like a woman scorned -- William Congreve,nor hell a fury like a woman scorned -- william congreve
2017-En-11111,If I do my homework now I can watch revenge and possibly go out tonight'\n*plays on phone for 2 hours to avoid doing homework,anger,1: low amount of anger can be inferred,1,If I do my homework now I can watch revenge and possibly go out tonight'\n*plays on phone for 2 hours to avoid doing homework,if i do my homework now i can watch revenge and possibly go out tonight'\n*plays on phone for 2 hours to avoid doing homework
2017-En-10714,@BarackObama I love Lizzy Warren's latest rage against Wall Street.,anger,0: no anger can be inferred,0,I love Lizzy Warren's latest rage against Wall Street.,i love lizzy warren's latest rage against wall street.
2017-En-10498,Skipping meals is the national way of showing #disappointment and #anger. #wiz,anger,1: low amount of anger can be inferred,1,Skipping meals is the national way of showing disappointment and anger. wiz,skipping meals is the national way of showing disappointment and anger. wiz
2017-En-11108,@zavierdaniels had to snap going crazy 😭😭,anger,1: low amount of anger can be inferred,1,had to snap going crazy loudly_crying_faceloudly_crying_face,had to snap going crazy loudly_crying_faceloudly_crying_face
2017-En-11130,@o2academybham since when the fuck can you not stand at a concert? #raging,anger,3: high amount of anger can be inferred,3,since when the fuck can you not stand at a concert? raging,since when the fuck can you not stand at a concert? raging
2017-En-11342,@jamiesmart Huh! It's always my fault isn't it &gt;:(  #sulk,anger,3: high amount of anger can be inferred,3,Huh! It's always my fault isn't it &gt;( sulk,huh! it's always my fault isn't it &gt;( sulk
2017-En-10994,"A guy was raging so hard during a rocket league game, when i beat him he started crying and i was laughing so hard lol",anger,0: no anger can be inferred,0,"A guy was raging so hard during a rocket league game, when i beat him he started crying and i was laughing so hard lol","a guy was raging so hard during a rocket league game, when i beat him he started crying and i was laughing so hard lol"
2017-En-11616,That last #madden commercial 😆😆😆😆😆😆 #TNF,anger,0: no anger can be inferred,0,That last madden commercial grinning_squinting_facegrinning_squinting_facegrinning_squinting_facegrinning_squinting_facegrinning_squinting_facegrinning_squinting_face TNF,that last madden commercial grinning_squinting_facegrinning_squinting_facegrinning_squinting_facegrinning_squinting_facegrinning_squinting_facegrinning_squinting_face tnf
2017-En-11062,"@Yannarell @LOLGOP Despite your #outrage fatigue, don't lose your shine",anger,1: low amount of anger can be inferred,1,"Despite your outrage fatigue, don't lose your shine","despite your outrage fatigue, don't lose your shine"
2017-En-10742,"All this from a cigarette burning in Laura's hand, the angle of her chin, the purse of her lips.'(104) Gorgeous transition!@laurengrodstein",anger,0: no anger can be inferred,0,"All this from a cigarette burning in Laura's hand, the angle of her chin, the purse of her lips.'(104) Gorgeous transition!","all this from a cigarette burning in laura's hand, the angle of her chin, the purse of her lips.'(104) gorgeous transition!"
2017-En-11231,"Being abroad is causing me to make spontaneous decisions and not worry about things which is good, but the type A part of me is fuming",anger,2: moderate amount of anger can be inferred,2,"Being abroad is causing me to make spontaneous decisions and not worry about things which is good, but the type A part of me is fuming","being abroad is causing me to make spontaneous decisions and not worry about things which is good, but the type a part of me is fuming"
2017-En-10064,Boycotting @DunkinDonuts till butter pecan comes back. I am furious,anger,3: high amount of anger can be inferred,3,Boycotting till butter pecan comes back. I am furious,boycotting till butter pecan comes back. i am furious
2017-En-11449,I hate not having the answers I need. #tomourssuck #prayinsnotcancer #angry,anger,3: high amount of anger can be inferred,3,I hate not having the answers I need. tomourssuck prayinsnotcancer angry,i hate not having the answers i need. tomourssuck prayinsnotcancer angry
2017-En-11254,"@MagicalMunicorn May I suggest, that you have a meal that is made with beans, onions &amp; garlic, the day before class. #revenge",anger,0: no anger can be inferred,0,"May I suggest, that you have a meal that is made with beans, onions &amp; garlic, the day before class. revenge","may i suggest, that you have a meal that is made with beans, onions &amp; garlic, the day before class. revenge"
2017-En-11101,@Who_JN I've been having a quad shot every day and can sleep right after... it's time to detox 😅 I get raging migraines without coffee :/,anger,1: low amount of anger can be inferred,1,I've been having a quad shot every day and can sleep right after... it's time to detox grinning_face_with_sweat I get raging migraines without coffee /,i've been having a quad shot every day and can sleep right after... it's time to detox grinning_face_with_sweat i get raging migraines without coffee /
2017-En-11086,@PearseDoherty @harrymcgee @IrishTimes That might sting for a bit lads but you'll get over it.     #betterwithsinnfein,anger,1: low amount of anger can be inferred,1,That might sting for a bit lads but you'll get over it. betterwithsinnfein,that might sting for a bit lads but you'll get over it. betterwithsinnfein
2017-En-11538,@JaredWyand Maybe if it was transgender the media would cover it #outrage,anger,2: moderate amount of anger can be inferred,2,Maybe if it was transgender the media would cover it outrage,maybe if it was transgender the media would cover it outrage
2017-En-41516,Boy oh boy! our weekday schedule is crazy! But no matter how tired I am I do whatever it takes to keep the smile on Kai's face from a frown,anger,0: no anger can be inferred,0,Boy oh boy! our weekday schedule is crazy! But no matter how tired I am I do whatever it takes to keep the smile on Kai's face from a frown,boy oh boy! our weekday schedule is crazy! but no matter how tired i am i do whatever it takes to keep the smile on kai's face from a frown
2017-En-10414,i can't believe they're all messing up my favourite of all bakes i feel personally offended,anger,2: moderate amount of anger can be inferred,2,i can't believe they're all messing up my favourite of all bakes i feel personally offended,i can't believe they're all messing up my favourite of all bakes i feel personally offended
2017-En-11578,10 minutes with an incense and all I get is 2 Rattatas. 😂#PokemonGO,anger,0: no anger can be inferred,0,10 minutes with an incense and all I get is 2 Rattatas. face_with_tears_of_joyPokemonGO,10 minutes with an incense and all i get is 2 rattatas. face_with_tears_of_joypokemongo
2017-En-10948,@virginmedia I've been disconnected whilst on holiday 😤 but I don't move house until the 1st October 🤔 #furious,anger,3: high amount of anger can be inferred,3,I've been disconnected whilst on holiday face_with_steam_from_nose but I don't move house until the 1st October thinking_face furious,i've been disconnected whilst on holiday face_with_steam_from_nose but i don't move house until the 1st october thinking_face furious
2017-En-10199,@canada4trumpnow @donlemon he has BAD TEMPERAMENT  #HissyFits,anger,3: high amount of anger can be inferred,3,he has BAD TEMPERAMENT HissyFits,he has bad temperament hissyfits
2017-En-11022,@rohan_connolly i think your high-profile female colleague would be one in yhat category... #massexodus #bitter,anger,1: low amount of anger can be inferred,1,i think your high-profile female colleague would be one in yhat category... massexodus bitter,i think your high-profile female colleague would be one in yhat category... massexodus bitter
2017-En-10117,angry already,anger,3: high amount of anger can be inferred,3,angry already,angry already
2017-En-10709,@CrayonToCrayon @SueScoby \nIt's always fun to anger 'All the Old Dudes.' with Rock N' Roll :)),anger,0: no anger can be inferred,0,\nIt's always fun to anger 'All the Old Dudes.' with Rock N' Roll )),\nit's always fun to anger 'all the old dudes.' with rock n' roll ))
2017-En-10536,"@iStoleFreeHugs @stephlaris lol I'm happy with my negative, realistic ass self. Sorry to offend you",anger,1: low amount of anger can be inferred,1,"lol I'm happy with my negative, realistic ass self. Sorry to offend you","lol i'm happy with my negative, realistic ass self. sorry to offend you"
